{
  "schema": "docwen.artifact_bundle.v3",
  "bundle_id": "bundle.gongwen.001",
  "task_id": "task.gongwen.001",
  "producer": {
    "name": "DocWen",
    "product_version": "0.9.0",
    "machine_protocol": "docwen.machine.v2"
  },
  "layout_schema": "docwen.document_node.v1",
  "artifacts": [
    {
      "artifact_id": "document.main",
      "kind": "document",
      "locator": "documents/notice.md",
      "logical_path": "notice/notice.md",
      "suggested_name": "notice.md",
      "media_type": "text/markdown",
      "size_bytes": 4096,
      "sha256": "1111111111111111111111111111111111111111111111111111111111111111"
    },
    {
      "artifact_id": "document.attachment.1",
      "kind": "document",
      "locator": "documents/attachments/budget.md",
      "logical_path": "notice/budget/budget.md",
      "suggested_name": "budget.md",
      "media_type": "text/markdown",
      "size_bytes": 1024,
      "sha256": "2222222222222222222222222222222222222222222222222222222222222222"
    },
    {
      "artifact_id": "resource.seal",
      "kind": "resource",
      "locator": "resources/seal.png",
      "logical_path": "notice/seal.png",
      "suggested_name": "seal.png",
      "media_type": "image/png",
      "size_bytes": 512,
      "sha256": "3333333333333333333333333333333333333333333333333333333333333333"
    }
  ],
  "entries": [
    {
      "artifact_id": "document.main",
      "role": "primary",
      "ordinal": 0,
      "preferred": true
    }
  ],
  "relations": [
    {
      "type": "attachment_of",
      "source_artifact_id": "document.attachment.1",
      "target_artifact_id": "document.main",
      "role": "attachment",
      "ordinal": 0
    },
    {
      "type": "resource_of",
      "source_artifact_id": "resource.seal",
      "target_artifact_id": "document.main",
      "role": "image"
    }
  ]
}
