{
  "schema": "docwen.artifact_bundle.v3",
  "bundle_id": "bundle.pdf-split.001",
  "task_id": "task.pdf-split.001",
  "producer": {
    "name": "DocWen",
    "product_version": "0.9.0",
    "machine_protocol": "docwen.machine.v2"
  },
  "layout_schema": "docwen.artifact_layout.v1",
  "artifacts": [
    {
      "artifact_id": "document.part.1",
      "kind": "document",
      "locator": "parts/part-001.pdf",
      "logical_path": "parts/part-001.pdf",
      "suggested_name": "part-001.pdf",
      "media_type": "application/pdf",
      "size_bytes": 1024,
      "sha256": "dddddddddddddddddddddddddddddddddddddddddddddddddddddddddddddddd"
    },
    {
      "artifact_id": "document.part.2",
      "kind": "document",
      "locator": "parts/part-002.pdf",
      "logical_path": "parts/part-002.pdf",
      "suggested_name": "part-002.pdf",
      "media_type": "application/pdf",
      "size_bytes": 1024,
      "sha256": "eeeeeeeeeeeeeeeeeeeeeeeeeeeeeeeeeeeeeeeeeeeeeeeeeeeeeeeeeeeeeeee"
    }
  ],
  "entries": [
    {
      "artifact_id": "document.part.1",
      "role": "section",
      "ordinal": 0,
      "preferred": false
    },
    {
      "artifact_id": "document.part.2",
      "role": "section",
      "ordinal": 1,
      "preferred": false
    }
  ],
  "relations": []
}
