{
  "schema": "docwen.artifact_bundle.v3",
  "bundle_id": "bundle.image-md.001",
  "task_id": "task.image-md.001",
  "producer": {
    "name": "DocWen",
    "product_version": "0.9.0",
    "machine_protocol": "docwen.machine.v2"
  },
  "layout_schema": "docwen.document_node.v1",
  "artifacts": [
    {
      "artifact_id": "document.image-index",
      "kind": "document",
      "locator": "documents/photo.md",
      "logical_path": "photo/photo.md",
      "suggested_name": "photo.md",
      "media_type": "text/markdown",
      "size_bytes": 128,
      "sha256": "aaaaaaaaaaaaaaaaaaaaaaaaaaaaaaaaaaaaaaaaaaaaaaaaaaaaaaaaaaaaaaaa"
    },
    {
      "artifact_id": "fragment.image-ocr",
      "kind": "fragment",
      "locator": "fragments/photo.ocr.md",
      "logical_path": "photo/photo-ocr/photo-ocr.md",
      "suggested_name": "photo.ocr.md",
      "media_type": "text/markdown",
      "size_bytes": 64,
      "sha256": "bbbbbbbbbbbbbbbbbbbbbbbbbbbbbbbbbbbbbbbbbbbbbbbbbbbbbbbbbbbbbbbb"
    },
    {
      "artifact_id": "resource.original-image",
      "kind": "resource",
      "locator": "resources/photo.png",
      "logical_path": "photo/photo.png",
      "suggested_name": "photo.png",
      "media_type": "image/png",
      "size_bytes": 2048,
      "sha256": "cccccccccccccccccccccccccccccccccccccccccccccccccccccccccccccccc"
    }
  ],
  "entries": [
    {
      "artifact_id": "document.image-index",
      "role": "primary",
      "ordinal": 0,
      "preferred": true
    }
  ],
  "relations": [
    {
      "type": "fragment_of",
      "source_artifact_id": "fragment.image-ocr",
      "target_artifact_id": "document.image-index",
      "role": "ocr_text",
      "ordinal": 0
    },
    {
      "type": "resource_of",
      "source_artifact_id": "resource.original-image",
      "target_artifact_id": "document.image-index",
      "role": "original"
    },
    {
      "type": "derived_from",
      "source_artifact_id": "fragment.image-ocr",
      "target_artifact_id": "resource.original-image",
      "role": "source"
    }
  ]
}
